key,title,year,month,day,journal,issn,volume,issue,pages,authors,url,language,publisher,location,abstract,notes,doi,keywords,pubmed_id,pmc_id
rayyan-934859045,Insights into the mechanisms of organic pollutant toxicity to earthworms: Advances and perspectives*,2022,6,15,ENVIRONMENTAL POLLUTION,"[""0269-7491"", ""1873-6424""]",303,NA,,"Zhao, WT and Teng, MM and Zhang, J and Wang, K and Zhang, JL and Xu, Y and Wang, CJ",,,,,"Earthworms play positive ecological roles in soil formation, structure, and fertility, environmental protection, and terrestrial food chains. For this review, we searched the Web of Science database for articles published from 2011 to 2021 using the keywords ""toxic"" and ""earthworm"" and retrieved 632 publications. From the perspective of bibliometric analysis, we conducted a co-occurrence network analysis using the keywords ""toxic"" and ""earthworm"" to identify the most and least reported topics. ""Eisenia fetida,"" ""bioaccumulation,"" ""heavy metals,"" ""oxidative stress,"" and ""pesticides"" were the most common terms, and ""microbial community,"" ""bacteria,"" ""PFOS,"" ""bioaugmentation,"" ""potentially toxic elements,"" ""celomic fluid,"" ""neurotoxicity,"" ""joint toxicity,"" ""apoptosis,"" and ""nanoparticles"" were uncommon terms. Additionally, in this review we highlight the main routes of organic pollutant entry into soil, and discuss the adverse effects on the soil ecosystem. We then systematically review the mechanisms underlying organic pollutant toxicity to earthworms, including oxidative stress, energy and lipid metabolism disturbances, neurological toxicity, intestinal inflammation and injury, gut microbiota dysbiosis, and reproductive toxicity. We conclude by discussing future research perspectives, focusing on environmentally relevant concentrations and conditions, novel data processing approaches, technologies, and detoxification and mitigation methods. This review has implications for soil management in the context of environmental pollution.",,10.1016/j.envpol.2022.119120,,NA,
rayyan-934859046,Metabolomics and Type 2 Diabetes Risk: An Updated Systematic Review and Meta-analysis of Prospective Cohort Studies,2022,4,NA,DIABETES CARE,"[""0149-5992"", ""1935-5548""]",45,4,1013-1024,"Morze, J and Wittenbecher, C and Schwingshackl, L and Danielewicz, A and Rynkiewicz, A and Hu, FB and Guasch-Ferre, M",,,,,"BACKGROUNDDue to the rapidly increasing availability of metabolomics data in prospective studies, an update of the meta evidence on metabolomics and type 2 diabetes risk is warranted. PURPOSETo conduct an updated systematic review and meta-analysis of plasma, serum, and urine metabolite markers and incident type 2 diabetes. DATA SOURCESWe searched PubMed and Embase until 6 March 2021. STUDY SELECTIONWe selected prospective observational studies where investigators used high-throughput techniques to investigate the relationship between plasma, serum, or urine metabolites and incident type 2 diabetes. DATA EXTRACTIONBaseline metabolites per-SD risk estimates and 95% CIs for incident type 2 diabetes were extracted from all eligible studies. DATA SYNTHESISA total of 61 reports with 71,196 participants and 11,771 type 2 diabetes cases/events were included in the updated review. Meta-analysis was performed for 412 metabolites, of which 123 were statistically significantly associated (false discovery rate-corrected P < 0.05) with type 2 diabetes risk. Higher plasma and serum levels of certain amino acids (branched-chain, aromatic, alanine, glutamate, lysine, and methionine), carbohydrates and energy-related metabolites (mannose, trehalose, and pyruvate), acylcarnitines (C4-DC, C4-OH, C5, C5-OH, and C8:1), the majority of glycerolipids (di- and triacylglycerols), (lyso)phosphatidylethanolamines, and ceramides included in meta-analysis were associated with higher risk of type 2 diabetes (hazard ratio 1.07-2.58). Higher levels of glycine, glutamine, betaine, indolepropionate, and (lyso)phosphatidylcholines were associated with lower type 2 diabetes risk (hazard ratio 0.69-0.90). LIMITATIONSSubstantial heterogeneity (I-2 > 50%, tau(2) > 0.1) was observed for some of the metabolites. CONCLUSIONSSeveral plasma and serum metabolites, including amino acids, lipids, and carbohydrates, are associated with type 2 diabetes risk.",,10.2337/dc21-1705,Cohort Studies,NA,
rayyan-934859047,"Conducting evaluations of evidence that are transparent, timely and can lead to health-protective actions",2022,12,5,ENVIRONMENTAL HEALTH,1476-069X,21,1,,"Chartres, N and Sass, JB and Gee, D and Balan, SA and Birnbaum, L and Cogliano, VJ and Cooper, C and Fedinick, KP and Harrison, RM and Kolossa-Gehring, M and Mandrioli, D and Mitchell, MA and Norris, SL and Portier, CJ and Straif, K and Vermeire, T",,,,,"Background: In February 2021, over one hundred scientists and policy experts participated in a web-based Workshop to discuss the ways that divergent evaluations of evidence and scientific uncertainties are used to delay timely protection of human health and the environment from exposures to hazardous agents. The Workshop arose from a previous workshop organized by the European Environment Agency (EEA) in 2008 and which also drew on case studies from the EEA reports on 'Late Lessons from Early Warnings' (2001, 2013). These reports documented dozens of hazardous agents including many chemicals, for which risk reduction measures were delayed for decades after scientists and others had issued early and later warnings about the harm likely to be caused by those agents. Results: Workshop participants used recent case studies including Perfluorooctanoic acid (PFOA), Extremely Low Frequency - Electrical Magnetic Fields (ELF-EMF fields), glyphosate, and Bisphenol A (BPA) to explore myriad reasons for divergent outcomes of evaluations, which has led to delayed and inadequate protection of the public's health. Strategies to overcome these barriers must, therefore, at a minimum include approaches that 1) Make better use of existing data and information, 2) Ensure timeliness, 3) Increase transparency, consistency and minimize bias in evidence evaluations, and 4) Minimize the influence of financial conflicts of interest. Conclusion: The recommendations should enhance the production of ""actionable evidence, "" that is, reliable evaluations of the scientific evidence to support timely actions to protect health and environments from exposures to hazardous agents. The recommendations are applicable to policy and regulatory settings at the local, state, federal and international levels.",,10.1186/s12940-022-00926-z,,NA,
rayyan-934859048,Patient-reported outcome measures for pain in women with pelvic floor disorders: a systematic review,2022,9,NA,INTERNATIONAL UROGYNECOLOGY JOURNAL,"[""0937-3462"", ""1433-3023""]",33,9,2325-2334,"Ralphsmith, M and Ahern, S and Dean, J and Ruseckaite, R",,,,,"Introduction and hypothesis Patient-reported outcome measures (PROMs) are helpful instruments when measuring and reporting changes in patient health status (Al Sayah et al. J Patient Rep Outcomes 5 (Suppl 2):99, 2021) such as the health-related quality of life (HrQoL) of women with pelvic organ prolapse (POP) and stress urinary incontinence (SUI). The Australasian Pelvic Floor Procedure Registry (APFPR) aims to increase capacity for women to report surgical outcomes through the collection of HrQoL data (Ruseckaite et al. Qual Life Res. 2021) but currently lacks a pain-specific PROM for women with pelvic floor disorders (PFDs), particularly POP and SUI. This review aims to systematically review the existing literature and identify instruments that measure pain in women with POP and SUI for inclusion within the APFPR, which reports on complications from these conditions.        Methods We conducted a literature search on OVID MEDLINE, Embase, CINAHL, PsycINFO and EMCARE databases in addition to Google Scholar and grey literature to identify studies from inception to April 2021. Full-text studies were included if they used PROMs to measure pain in women with POP and SUI. Two authors independently screened articles, extracted data and assessed methodological quality.        Results From 2001 studies, 23 publications describing 19 different PROMs were included for analysis. Eight of these instruments were specific to the pelvic floor; four were only specific to pain and used across multiple disorders; three were generic quality of life instruments and four were other non-validated instruments such as focus group interviews. These instruments were not specific to pain in women with POP or SUI, as they did not identify all relevant domains such as the sensation, region and duration of pain, or incidents where onset of pain occurs.        Conclusions The findings of this review suggest there are no current PROMs that are suitable pain-specific instruments for women with POP or SUI. This knowledge may inform and assist in the development of a new PROM to be implemented into the APFPR.",,10.1007/s00192-022-05126-4,Pain Measurement;Pelvic Floor,NA,
rayyan-934859049,To what extent are filter feeder elasmobranchs exposed to marine pollution? A systematic review,2023,2,1,ENVIRONMENTAL POLLUTION,"[""0269-7491"", ""1873-6424""]",318,NA,,"Boldrocchi, G and Monticelli, D and Bettinetti, R",,,,,"Filter feeding elasmobranchs may be considered as biological indicators of marine pollution, despite most of these species are under some degree of extinction risk. Among threats to this taxonomic group, marine pollution might represent an additional concern for their survival. In this review, a comprehensive systematic search of scientific literature on pollutants in filter feeding elasmobranchs was conducted to evaluate the bioaccumulation patterns, and risk for human consumers. We found that, despite an increasing trend in the number of published studies, the geographical coverage is still very limited and most of the studies focused solely on trace elements (70.8%). Among sharks, Rhincodon typus was the most represented species (66.7%), while Mobula mobular the most studied ray species (41.7%). Comparing the levels of pollutants in filter feeders between ocean basins, this review highlighted that Hg, As and Cd levels are mostly higher in those areas affected by both strong natural and anthropogenic source of emissions, such as the Indian Ocean. With regards to OCs, SPCB levels in muscle of C. maximus were between 4.3 and 50.5 mu g kg(-1) ww, highlighting a persistent contamination of PCB in the Mediterranean Sea. Some species exceeded the maximum allowable limits for foodstuff consumption for As, Cd and Pb. A total of 77.8% of the analyzed species exceeded the Environmental Quality Standards for Hg, while they were always below the EQS(biota) for HCB, PBDEs, PFOS and DDT. Given their feeding mechanism that continuously samples the marine environment, further investigations are urgently needed to determine not only the extent of contaminant exposure in different hotspot locations but also the risks posed to the elasmobranch health.",,10.1016/j.envpol.2022.120881,Military Personnel,NA,
rayyan-934859050,Chemical Diversity of Flavan-3-Ols in Grape Seeds: Modulating Factors and Quality Requirements,2022,3,NA,PLANTS-BASEL,2223-7747,11,6,,"Padilla-Gonzalez, GF and Grosskopf, E and Sadgrove, NJ and Simmonds, MSJ",,,,,"Grape seeds are a rich source of flavan-3-ol monomers, oligomers, and polymers. The diverse profile of compounds includes mainly B-type procyanidins (especially C4 -> C8 linked molecules) and the key monomers, catechin, and epicatechin that are positively implicated in the 'French Paradox'. Today grape seed nutraceuticals have become a multi-million-dollar industry. This has created incentives to elucidate the variations in chemistry across cultivars, to identify signs of adulteration, and to understand the intrinsic and extrinsic factors controlling the expression of metabolites in the seeds' metabolome. This review provides a critical overview of the existing literature on grape seed chemistry. Although the biosynthetic pathways for polymeric procyanidins in seeds have not yet been explained, abiotic factors have been shown to modulate associated genes. Research of extrinsic factors has demonstrated that the control of procyanidin expression is strongly influenced, in order of importance, by genotype (species first, then variety) and environment, as claimed anecdotally. Unfortunately, research outcomes on the effects of abiotic factors have low certainty, because effects can be specific to genotype or variety, and there is limited control over physical metrics in the field. Thus, to gain a fuller understanding of the effects of abiotic factors and biosynthetic pathways, and realise potential for optimisation, a more fundamental research approach is needed. Nevertheless, the current synthesis offers insight into the selection of species or varieties according to the profile of polyphenols, as well as for optimisation of horticultural practices, with a view to produce products that contain the compounds that support health claims.",,10.3390/plants11060809,,NA,
rayyan-934859051,Specific Metabolites Involved in Antioxidation and Mitochondrial Function Are Correlated With Frailty in Elderly Men,2022,1,28,FRONTIERS IN MEDICINE,2296-858X,9,NA,,"Meng, L and Shi, H and Wang, DG and Shi, J and Wu, WB and Dang, YM and Fan, GQ and Shen, J and Yu, PL and Dong, J and Yang, RY and Xi, H",,,,,"BackgroundAs an age-related syndrome, frailty may play a central role in poor health among older adults. Sarcopenia overlaps with the physical domain of frailty, and most existing studies have analyzed the associated factors of frailty and sarcopenia as an isolated state. Perturbations in metabolism may play an important role in the presence of frailty or sarcopenia; however, the metabolites associated with frailty, especially overlapping with sarcopenia remain unclear. In this study, we aimed to explore whether amino acids, carnitines, acylcarnitines and lysophosphatidylcholines, as specific panels, are significantly correlated with frailty, especially overlapping with sarcopenia, to gain insight into potential biomarkers and possible biological mechanisms and to facilitate their management. MethodsWe applied a targeted high-performance liquid chromatography-tandem mass spectrometry approach in serum samples from 246 Chinese older men (age 79.2 +/- 7.8 years) with frailty (n = 150), non-frailty (n = 96), frailty and sarcopenia (n = 52), non-frail and non-sarcopenic control (n = 85). Frailty was evaluated using Freid phenotype criteria, sarcopenia was defined by diagnostic algorithm of Asian Working Group on Sarcopenia, and the participants were diagnosed as frailty and sarcopenia when they met the evaluation criteria of both frailty and sarcopenia. A panel of 29 metabolomic profiles was assayed and included different classes of amino acids, carnitines, acylcarnitines, and lysophosphatidylcholines (LPCs). Multivariate logistic regression was used to screen the metabolic factors contributing to frailty status, and orthogonal partial least squares discriminant analysis was used to explore important factors and distinguish different groups. ResultsIn older men demonstrating the frail phenotype, amino acid perturbations included lower tryptophan and higher glycine levels. With regard to lipid metabolism, the frailty phenotype was characterized by lower concentrations of isovalerylcarnitine (C5), LPC16:0 and LPC18:2, while higher levels of octanoyl-L-carnitine (C8), decanoyl-L-carnitine (C10), dodecanoyl-L-carnitine (C12) and tetradecanoyl-L-carnitine (C14). After adjusting for several clinical confounders, tryptophan, LPC18:2, LPC 16:0 and C5 were negatively correlated with frailty, and C8 and C12 were positively related to frailty. We preliminarily identified metabolic profiles (LPC16:0, LPC18:2, glycine and tryptophan) that may distinguish older men with frailty from those without frailty. Importantly, a set of serum amino acids and LPCs (LPC16:0, LPC18:2, and tryptophan) was characterized in the metabotype of older adults with an overlap of frailty and sarcopenia. The metabolites that were most discriminating of frailty status implied that the underlying mechanism might be involved in antioxidation and mitochondrial dysfunction. ConclusionsThese present metabolic analyses may provide valuable information on the potential biomarkers and possible biological mechanisms of frailty, and overlapping sarcopenia. The findings obtained may offer insight into their management in older adults.",,10.3389/fmed.2022.816045,Antioxidants,NA,
rayyan-934859052,The Role of Focal Approach as Alternative to Nephron- Sparing Surgery in the Treatment of Stage I Cancer in Renal Graft: Results of a Systematic Review,2022,1,1,TURK ONKOLOJI DERGISI-TURKISH JOURNAL OF ONCOLOGY,1300-7467,NA,NA,351-360,"Posa, A and Lancellotta, V and Paoletti, F and Tanzilli, A and Acampora, A and Jereczek-Fossa, BA and Gambacorta, MA and Romagnoli, J and Grasso, RF and Veltri, A and Kovacs, G and Valentini, V and Manfredi, R and Iezzi, R and Tagliaferri, L",,,,,"In patients with kidney graft neoplasms, the treatment of choice is still represented by surgical approach, mainly based on partial nephrectomy/nephron sparing surgery (NSS). In this oncologic setting, focal treatments (FT) are becoming more and more useful to avoid the risk of dialysis, considering graft viability of utmost importance. There is still little evidence on which is the best FT option in kidney graft neoplasms and on its therapeutic indications. We performed a systematic review to assess the role of FT such as thermal ablation, interventional radiotherapy, electrochemotherapy, and stereotactic body radiotherapy, as alternative to NSS in the treatment of Stage I kidney cancer. We searched PubMed, Scopus, and Web of Science for articles published between 2010 and 2020 focusing on kidney transplant recipients with kidney graft neoplasm who had undergone FT. The review is framed by the population, intervention, control, and outcomes criteria. The studies underlined safety and efficacy of FT, with low morbidity and good graft survival, but none of them provided a direct comparison with graft nephrectomy or NSS. There is still no clear evidence that FTs, and percutaneous ones in particular, are indicated as a standard treatment in kidney graft neoplasms as opposed to total or partial graft nephrectomy.  2022, Turkish Society for Radiation Oncology.",,10.5505/tjo.2022.2891,Neoplasm Staging;Kidney Neoplasms,NA,
rayyan-934859053,Cell-Cell Interaction-Mediated Signaling in the Testis Induces Reproductive DysfunctionLesson from the Toxicant/ Pharmaceutical Models,2022,2,1,CELLS,2073-4409,11,4,,"Wang, LL and Bu, T and Wu, XL and Gao, S and Li, XY and De Jesus, AB and Wong, CKC and Chen, H and Chung, NPY and Sun, F and Cheng, CY",,,,,"Emerging evidence has shown that cell-cell interactions between testicular cells, in par-ticular at the Sertoli cell-cell and Sertoli-germ cell interface, are crucial to support spermatogenesis. The unique ultrastructures that support cell-cell interactions in the testis are the basal ES (ectoplas-mic specialization) and the apical ES. The basal ES is found between adjacent Sertoli cells near the basement membrane that also constitute the blood-testis barrier (BTB). The apical ES is restrictively expressed at the Sertoli-spermatid contact site in the apical (adluminal) compartment of the sem-iniferous epithelium. These ultrastructures are present in both rodent and human testes, but the majority of studies found in the literature were done in rodent testes. As such, our discussion herein, unless otherwise specified, is focused on studies in testes of adult rats. Studies have shown that the testicular cell-cell interactions crucial to support spermatogenesis are mediated through distinctive signaling proteins and pathways, most notably involving FAK, Akt1/2 and Cdc42 GTPase. Thus, manipulation of some of these signaling proteins, such as FAK, through the use of phosphomimetic mutants for overexpression in Sertoli cell epithelium in vitro or in the testis in vivo, making FAK either constitutively active or inactive, we can modify the outcome of spermatogenesis. For instance, using the toxicant-induced Sertoli cell or testis injury in rats as study models, we can either block or rescue toxicant-induced infertility through overexpression of p-FAK-Y397 or p-FAK-Y407 (and their mutants), including the use of specific activator(s) of the involved signaling proteins against pAkt1/2. These findings thus illustrate that a potential therapeutic approach can be developed to manage toxicant-induced male reproductive dysfunction. In this review, we critically evaluate these recent findings, highlighting the direction for future investigations by bringing the laboratory-based research through a translation path to clinical investigations.  2022 by the authors. Licensee MDPI, Basel, Switzerland.",,10.3390/cells11040591,Cell Communication,NA,
rayyan-934859054,Metatranscriptomic Analysis of the Chicken Gut Resistome Response to In-Feed Antibiotics and Natural Feed Additives,2022,4,14,FRONTIERS IN MICROBIOLOGY,1664-302X,13,NA,,"Koorakula, R and Schiavinato, M and Ghanbari, M and Wegl, G and Grabner, N and Koestelbauer, A and Klose, V and Dohm, JC and Domig, KJ",,,,,"The emergence of resistance against common antibiotics in the gut microbiota is a major issue for both human and livestock health. This highlights the need for understanding the impact of such application on the reservoir of antibiotic resistance genes in poultry gut and devising means to circumvent the potential resistome expansion. Phytogenic feed additives (PFAs) are potential natural alternative to antibiotic to improve animal health and performance, supposedly via positively affecting the gut microbial ecosystem, but there is little systematic information available. In this time-course study, we applied a shotgun meta-transcriptomics approach to investigate the impact of a PFA product as well as the commonly used antibiotic, zinc bacitracin either at AGP concentration or therapeutic concentration on the gut microbiome and resistome of broiler chickens raised for 35 days. Over the course of the trial, PFA treatments increased the abundance of Firmicutes such as Lactobacillus and resulted in a lower abundance of Escherichia, while the latter group increased significantly in the feces of chickens that received either AGP or AB doses of bacitracin. Tetracycline resistance and aminoglycoside resistance were the predominant antibiotic resistance gene (ARG) classes found, regardless of the treatment. PFA application resulted in a decrease in abundance of ARGs compared to those in the control group and other antibiotic treatment groups. In summary, the findings from this study demonstrate the potential of phytogenic feed additives could be an alternative to antibiotics in poultry farming, with the added benefit of counteracting antimicrobial resistance development.",,10.3389/fmicb.2022.833790,Anti-Bacterial Agents;Chickens,NA,
rayyan-934859055,"Chemicals/materials of emerging concern in farmlands: sources, crop uptake and potential human health risks",2022,12,14,ENVIRONMENTAL SCIENCE-PROCESSES & IMPACTS,"[""2050-7887"", ""2050-7895""]",24,12,2217-2236,"Maddela, NR and Ramakrishnan, B and Duenas-Rivadeneira, AA and Venkateswarlu, K and Megharaj, M",,,,,"Certain chemicals/materials that are contaminants of emerging concern (CECs) have been widely detected in water bodies and terrestrial systems worldwide while other CECs occur at undetectable concentrations. The primary sources of CECs in farmlands are agricultural inputs, such as wastewater, biosolids, sewage sludge, and agricultural mulching films. The percent increase in cropland area during 1950-2016 was 30 and the rise in land use for food crops during 1960-2018 was 100-500%, implying that there could be a significant CEC burden in farmlands in the future. In fact, the alarming concentrations (mu g kg(-1)) of certain CECs such as PBDEs, PAEs, and PFOS that occur in farmlands are 383, 35 400 and 483, respectively. Also, metal nanoparticles are reported even at the mg kg(-1) level. Chronic root accumulation followed by translocation of CECs into plants results in their detectable concentrations in the final plant produce. Thus, there is a continuous flow of CECs from farmlands to agricultural produce, causing a serious threat to the terrestrial food chain. Consequently, CECs find their way to the human body directly through CEC-laden plant produce or indirectly via the meat of grazing animals. Thus, human health could be at the most critical risk since several CECs have been shown to cause cancers, disruption of endocrine and cognitive systems, maternal-foetal transfer, neurotoxicity, and genotoxicity. Overall, this comprehensive review provides updated information on contamination of chemicals/materials of concern in farmlands globally, sources for their entry, uptake by crop plants, and their likely impact on the terrestrial food chain and human health.",,10.1039/d2em00322h,Humanities;Humanism;Humans,NA,
