key,title,year,month,day,journal,issn,volume,issue,pages,authors,url,language,publisher,location,abstract,notes,doi,keywords,pubmed_id,pmc_id
rayyan-934859254,Foot orthoses for treating paediatric flat feet,2022,NA,NA,Cochrane Database of Systematic Reviews,1465-1858,NA,1,,"Evans, AM and Rome, K and Carroll, M and Hawke, F",http://dx.doi.org/10.1002/14651858.CD006311.pub4,,"John Wiley & Sons, Ltd",,"Abstract - Background Paediatric flat feet are a common presentation in primary care; reported prevalence approximates 15%. A minority of flat feet can hurt and limit gait. There is no optimal strategy, nor consensus, for using foot orthoses (FOs) to treat paediatric flat feet. Objectives To assess the benefits and harms of foot orthoses for treating paediatric flat feet. Search methods We searched CENTRAL, MEDLINE, and Embase to 01 September 2021, and two clinical trials registers on 07 August 2020. Selection criteria We identified all randomised controlled trials (RCTs) of FOs as an intervention for paediatric flat feet. The outcomes included in this review were pain, function, quality of life, treatment success, and adverse events. Intended comparisons were: any FOs versus sham, any FOs versus shoes, customised FOs (CFOs) versus prefabricated FOs (PFOs). Data collection and analysis We followed standard methods recommended by Cochrane. Main results We included 16 trials with 1058 children, aged 11 months to 19 years, with flexible flat feet. Distinct flat foot presentations included asymptomatic, juvenile idiopathic arthritis (JIA), symptomatic and developmental coordination disorder (DCD). The trial interventions were FOs, footwear, foot and rehabilitative exercises, and neuromuscular electrical stimulation (NMES). Due to heterogeneity, we did not pool the data. Most trials had potential for selection, performance, detection, and selective reporting bias. No trial blinded participants. We present the results separately for asymptomatic (healthy children) and symptomatic (children with JIA) flat feet. The certainty of evidence was very low to low, downgraded for bias, imprecision, and indirectness. Three comparisons were evaluated across trials: CFO versus shoes; PFO versus shoes; CFO versus PFO. Asymptomatic flat feet 1.  CFOs versus shoes  (1 trial, 106 participants): lowquality evidence showed that CFOs result in little or no difference in the proportion without pain (10point visual analogue scale (VAS)) at one year (risk ratio (RR) 0.85, 95% confidence interval (CI) 0.67 to 1.07); absolute decrease (11.8%, 95% CI 4.7% fewer to 15.8% more); or on withdrawals due to adverse events (RR 1.05, 95% CI 0.94 to 1.19); absolute effect (3.4% more, 95% CI 4.1% fewer to 13.1% more). 2.  PFOs versus shoes  (1 trial, 106 participants): low to verylow quality evidence showed that PFOs result in little or no difference in the proportion without pain (10point VAS) at one year (RR 0.94, 95% CI 0.76 to 1.16); absolute effect (4.7% fewer, 95% CI 18.9% fewer to 12.6% more); or on withdrawals due to adverse events (RR 0.99, 95% CI 0.79 to 1.23). 3.  CFOs versus PFOs  (1 trial, 108 participants): lowquality evidence found no difference in the proportion without pain at one year (RR 0.93, 95% CI 0.73 to 1.18); absolute effect (7.4% fewer, 95% CI 22.2% fewer to 11.1% more); or on withdrawal due to adverse events (RR 1.00, 95% CI 0.90 to 1.12). Function and quality of life (QoL) were not assessed. Symptomatic (JIA) flat feet 1.  CFOs versus shoes  (1 trial, 28 participants, 3month followup): very lowquality evidence showed little or no difference in pain (0 to 10 scale, 0 no pain) between groups (MD 1.5, 95% CI 2.78 to 0.22). Lowquality evidence showed improvements in function with CFOs (Foot Function Index  FFI disability, 0 to 100, 0 best function; MD 18.55, 95% CI 34.42 to 2.68), childrated QoL (PedsQL, 0 to 100, 100 best quality; MD 12.1, 95% CI 1.6 to 25.8) and parentrated QoL (PedsQL MD 9, 95% CI 4.1 to 22.1) and little or no difference between groups in treatment success (timed walking; MD 1.33 seconds, 95% CI 2.77 to 0.11), or withdrawals due to adverse events (RR 0.58, 95% CI 0.11 to 2.94); absolute difference (9.7% fewer, 20.5 % fewer to 44.8% more). 2.  PFOs versus shoes  (1 trial, 25 participants, 3month followup): very lowquality evidence showed little or no difference in pain between groups (MD 0.02, 95% CI 1.94 to 1.98). Lowquality evidence showed no difference between groups in function (FFIdisability MD 4.17, 95% CI 24.4 to 16.06), childrated QoL (PedsQL MD 3.84, 95% CI 19 to 11.33), or parentrated QoL (PedsQL MD 0.64, 95% CI 13.22 to 11.94). 3.  CFOs versus PFOs  (2 trials, 87 participants): lowquality evidence showed little or no difference between groups in pain (0 to 10 scale, 0 no pain) at 3 months (MD 1.48, 95% CI 3.23 to 0.26), function (FFIdisability MD 7.28, 95% CI 15.47 to 0.92), childrated QoL (PedsQL MD 8.6, 95% CI 3.9 to 21.2), or parentrated QoL (PedsQL MD 2.9, 95% CI 11 to 16.8). Authors' conclusions Low to very lowcertainty evidence shows that the effect of CFOs (high cost) or PFOs (low cost) versus shoes, and CFOs versus PFOs on pain, function and HRQoL is uncertain. This is pertinent for clinical practice, given the economic disparity between CFOs and PFOs. FOs may improve pain and function, versus shoes in children with JIA, with minimal delineation between costly CFOs and generic PFOs. This review updates that from 2010, confirming that in the absence of pain, the use of highcost CFOs for healthy children with flexible flat feet has no supporting evidence, and draws very limited conclusions about FOs for treating paediatric flat feet. The availability of normative and prospective foot development data, dismisses most flat foot concerns, and negates continued attention to this topic. Attention should be redirected to relevant paediatric foot conditions, which cause pain, limit function, or reduce quality of life. The agenda for researching asymptomatic flat feet in healthy children must be relegated to history, and replaced by a targeted research rationale, addressing children with indisputable foot pathology from discrete diagnoses, namely JIA, cerebral palsy, congenital talipes equino varus, trisomy 21 and Charcot Marie Tooth. Whether research resources should continue to be wasted on studying flat feet in healthy children that do not hurt, is questionable. Future updates of this review will address only relevant paediatric foot conditions. Plain language summary Foot orthoses for treating flat feet in children Review question What are the benefits and harms of using foot orthoses (shoe inserts) to treat flat feet in children? Background Children with flat feet have a lower foot arch. When the child is standing, the foot arch looks flat against the floor, and may roll inwards, and even touch the floor. Sometimes, flat feet can cause pain, or change the way a child walks. There are many types of nonsurgical treatments for flat feet, but unless painful, most children do not need any treatment. Foot orthoses (FOs) or shoe inserts, muscle stretching, footwear selection, physical activity modification, and reducing body weight, may be part of an overall foot and activity management. The shortterm use of medication for pain and inflammation may be prescribed. Study characteristics This Cochrane Review is current to September 2021. There are 16 studies (1058 children, aged 11 months to 19 years) including three groups  healthy children with painless flat feet; children with arthritis and painful flat feet; others (developmental coordination disorder; painful flat feet). The studies were conducted across the USA, Australia, India, Iran, Turkey, UK, and Republic of Korea. We found information about footwear, exercises, and different types of foot orthoses. Results: Comparing custom foot orthoses  ( CFOs) to shoes in painless flat feet: Proportion without pain (1 trial, 106 children) at 12 months: 12% fewer children with CFOs were without pain (ranging from 26% fewer to 5.5% more) 67 out of 100 children were without pain with CFOs compared to 79 children out of 100 with shoes. Withdrawal due to side effects (3 trials, 211 children): 3% more children with CFOs withdrew from treatment due to side effects (ranging from 4% fewer to 13% more) . 72 out of 100 children withdrew from treatment with CFOs compared with 69 children out of 100 with shoes. Comparing prefabricated foot orthoses (PFOs) to shoes in painless flat feet Proportion without pain (1 trial, 106 children) at 12 months: 5% fewer children with PFOs were without pain (ranging from 18.9% fewer to 12.6% more) 74 out of 100 children were without pain with PFOs compared to 79 out of 100 children with shoes. Withdrawal due to side effects (4 trials, 338 children): 0.7% fewer children with PFOs withdrew from treatment due to side effects (ranging from 15.2% fewer to 16.6% more). 71 out of 100 children withdrew from treatment with PFOs compared with 72 out of 100 children with shoes. Comparing CFOs to PFOs in painless flat feet Proportion without pain (1 trial, 106 children) at 12 months: 7% fewer children with CFOs were without pain (ranging from 22.2% fewer to 11.1% more) 68 out of 100 children were without pain with CFOs compared to 74 out of 100 children with PFOs. Withdrawal due to side effects (1 trial, 118 children): 0% fewer children withdrew from treatment with CFOs due to side effects (ranging from 9.2% fewer to 11% more). 91 out of 100 children withdrew from treatment with CFOs compared with 91 out of 100 children with PFOs. Function, quality of life, treatment success and side effects were not reported in these trials Quality of the evidence In healthy children with painless flat feet, low to very lowquality evidence shows that compared to shoes, CFOs and PFOs result in no difference in the proportion without pain or withdrawal due to side effects from treatment. The quality of the evidence is very low to low, weakening conclusions. We downgraded the certainty of the evidence because the trials were poorly conducted and there were not enough data.",[Musculoskeletal],10.1002/14651858.CD006311.pub4,*Flatfoot [therapy];*Foot Orthoses;Child;Humans;Pain;Pain Measurement;Quality of Life;Orthotic Devices;Foot Orthoses;Foot,NA,
rayyan-934859255,Endovascular therapy versus medical treatment for spontaneous isolated dissection of the superior mesenteric artery,2022,NA,NA,Cochrane Database of Systematic Reviews,1465-1858,NA,9,,"Qiu, C and Wu, Z and He, Y and Tian, L and Zhu, Q and Shang, T and Zhang, H and Li, D",http://dx.doi.org/10.1002/14651858.CD014703.pub2,,"John Wiley & Sons, Ltd",,"Abstract - Background Spontaneous isolated dissection of the superior mesenteric artery (SIDSMA) occurs when a tear in the inner layer of the superior mesenteric artery (SMA) allows blood to flow between the layers of the SMA, forcing the layers apart, and creating two lumens. Abdominal pain is the most prevalent clinical manifestation. Other people may have no symptoms or experience nausea, vomiting, diarrhea, or blood in their stools. For people with SIDSMA who are not suspected of intestinal necrosis or intraabdominal bleeding, medical treatment and endovascular therapy are the main treatment options. There is no consensus on the optimum firstline management strategy. Objectives To evaluate the benefits and harms of endovascular therapy versus medical treatment for spontaneous isolated dissection of the superior mesenteric artery (SIDSMA). Search methods We used standard, extensive Cochrane search methods. The latest search date was 3 August 2021. Selection criteria We planned to include all randomized controlled trials (RCTs) which compared endovascular therapy and medical treatments for SIDSMA. We planned to exclude studies where participants were treated with open surgery. Data collection and analysis We used standard Cochrane methods. Our primary outcomes were endovascular intervention rate and recurrent abdominal pain. Our secondary outcomes were open surgery rate, remodeling rate of SMA, new aneurysm formation of SMA, SMA occlusion, new dissection of SMA, death, symptom relief rate and complications of endovascular therapy. We planned to use GRADE to assess certainty of evidence for each outcome. Main results We did not identify any RCTs to include in any analysis. Authors' conclusions We were not able to include any RCTs that compared endovascular therapy versus medical treatment in people with SIDSMA. Highquality RCTs that evaluate the benefits and harms of these interventions are needed to help determine the optimal strategy for managing SIDSMA. Plain language summary Endovascular therapy versus medical treatment for spontaneous isolated dissection of the superior mesenteric artery Key message There is not enough evidence to compare the benefits and harms of the two main options for treating people with spontaneous dissection of the mesenteric artery (SIDSMA). Why is this question important? Blood vessels are made up of different layers. If one of these layers rips or ruptures, blood can flow between the layers, pushing the layers apart and creating two channels for the blood to flow through, which stops the blood from delivering oxygen and nutrients. A spontaneous isolated dissection of the superior mesenteric artery (SIDSMA) occurs after a rupture in one of the main blood vessels in the abdomen (stomach area), called the superior mesenteric artery, happens for no clear reason and not in any other main vessels. People may not show any symptoms, or they may have abdominal pain, feel sick, vomit, have diarrhea or blood in their stools. There are two main treatment options for people with SIDSMA. The first is medical treatment, where people are given nutrients through a line straight into the blood. This means the stomach and intestines (where food is digested) do not need as much blood. This gives the ruptured vessels time to recover. The second option is endovascular therapy, where a small incision is made in the groin area or in the elbow pit and a small tube (stent) is placed into the blood vessel to seal the rupture and restore normal blood flow. Medical treatment is not always successful and the stent may not continue to maintain normal blood flow for a long time after endovascular therapy. It is important to know about the benefits and harms of both of these options so that doctors and people with SIDSMA can make the best decision about treatment. What did we do? We searched the literature for randomized controlled trials which compared endovascular therapy with medical treatment for managing SIDSMA. In randomized controlled trials the treatments people receive are decided at random, and these give the most reliable evidence about treatment effects. What did we find? We did not find any studies comparing endovascular therapy with medical treatment. How certain are we with the evidence? There is a lack of evidence to help answer this question. Highquality studies are needed to help inform the best treatment options. How up to date is this evidence? The evidence is current to 3 August 2021.",[Vascular],10.1002/14651858.CD014703.pub2,"*Endovascular Procedures [methods];Abdominal Pain [etiology, therapy];Humans;Mesenteric Artery, Superior [surgery];Tomography, X-Ray Computed;Treatment Outcome;Mesenteric Arteries;Mesenteric Artery, Superior",NA,
rayyan-934859257,The Impact of Psychological First aid Training on the Providers: A Systematic Review.,2022,NA,NA,Disaster medicine and public health preparedness,1938-744X,NA,NA,1-5,Movahed M and Khaleghi-Nekou M and Alvani E and Sharif-Alhoseini M,http://www.epistemonikos.org/documents/5dfc57756c11f00017f863b81a5c952549c628bb,English,,,"OBJECTIVE: The consensus is that psychological first aid is a practical, early psychosocial intervention to mitigate the distress caused by disasters. This review aimed to investigate PFA training's efficacy in the existing studies and evaluate these programs' impact on trainees.     METHODS: MEDLINE (National Library of Medicine, Bethesda, MD), EMBASE (Elsevier, Amsterdam, Netherlands), PsycInfo (American Psychological Association, Washington, DC), and Cochrane Library (John Wiley & Sons, Hobken, NJ, USA) were searched on August 1, 2020 without language and date limitation. The Cochrane Risk of Bias tool for randomized controlled trials and the Risk of Bias in Non-Randomized Studies - of Interventions (ROBINS-I) (Cochrane, London, UK) were used to assess the quality of the studies included. SPSS (IBM Corp., Endicott, NY, USA) was used for descriptive, comparative, and correlational summaries.     RESULTS: From 376 articles, only 9 studies met the criteria and were included after screening. The most common outcome was knowledge improvement, followed by increased confidence, and competence. Other outcomes encompassed Attitude, preparedness, and therapeutic engagement.     CONCLUSION: PFA is the most suggested early intervention aftermath and could be acquired by professionals and non-professionals in the mental health area. Nonetheless, to obtain the desired outcome, PFA training programs' quality is vital. This review revealed that most training programs' duration was short, without scenario-based interactions and post-training supervisions. More controlled trials are required to measure the effectiveness of PFA training on the providers.",,10.1017/dmp.2022.27,Acquired Immunodeficiency Syndrome,NA,
rayyan-934859262,The effects of perfluoroalkyl and polyfluoroalkyl substances on female fertility: A systematic review and meta-analysis.,2022,NA,NA,Environmental research,1096-0953,216,NA,114718,Wang W and Hong X and Zhao F and Wu J and Wang B,http://www.epistemonikos.org/documents/e7130869d2ec01aa8c230faadeff72a3e5b56c7d,English,,,"OBJECTIVE: The reproductive toxicity of perfluoroalkyl and polyfluoroalkyl substances (PFAS) has been verified in both animal and in vitro experiments, however, the association between PFAS and female fertility remains contradictory in population studies. Therefore, in this systematic review and meta-analysis, we evaluated the effects of PFAS on female fertility based on population evidence.     METHODS: Electronic searches of the Web of Science, PubMed, The Cochrane Library, and Embase databases were conducted (from inception to March 2022) to collect observational studies related to PFAS and female fertility. Two evaluators independently screened the literature, extracted information and evaluated the risk of bias for the included studies, meta-analysis was performed using R software.     RESULTS: A total of 5468 records were searched and 13 articles fully met the inclusion criteria. Meta-analysis showed that perfluorooctanoic acid (PFOA) exposure was negatively associated with the female fecundability odds ratio (FOR=0.88, 95% confidence interval (Cl) [0.78; 0.98]) and positively associated with the odds ratio for infertility (OR=1.33, 95%Cl [1.03; 1.73]). Perfluorooctane sulfonate (PFOS) exposure was negatively associated with the fecundability odds ratio (FOR=0.94, 95% CI [0.90; 0.98]). Pooled effect values for perfluorononanoic acid (PFNA), perfluorodecanoic acid (PFDA), and perfluorohexane sulfonate (PFHxS) exposure did not find sufficient evidence for an association with female fertility.     CONCLUSION: Based on the evidence provided by the current study, increased levels of PFAS exposure are associated with reduced fertility in women, this was characterized by a reduction in fecundability odds ratio and an increase in odds ratio for infertility. This finding could partially explain the decline in female fertility and provide insight into risk assessment when manufacturing products containing PFAS.",,10.1016/j.envres.2022.114718,Fertilizers;Fertility;Self-Fertilization,NA,
rayyan-934859266,"Associations between partial foot amputation level, gait parameters, and minimum impairment criteria in para-sport: A research study protocol.",2022,NA,NA,Sports medicine and health science,2666-3376,4,1,70-73,de Oliveira FCL and Williamson S and Ardern CL and Heron N and van Rensburg DCJ and Jansen MGT and O'Connor S and Schoonmade L and Thornton J and Pluim BM,http://www.epistemonikos.org/documents/a36716524bc707270cb4b68abadffde4d1194ffc,English,,,"Altered biomechanics due to amputation can contribute to substantial limitations, influencing sporting activities. Individuals with lower extremity amputations or congenital lower limb deficiency are encouraged to participate in para-sports. However, to compete in Paralympic sports, the candidate must have an impairment that results in lower extremity loss of function and meets or exceeds the sport's minimum impairment criteria (MIC). This review will focus on the MIC for competitive wheelchair tennis. Limb deficiency is known as one of the MIC used to regulate participation in competitive para-sports since it impacts gait, kinematics, and biomechanics of both the upper and lower body. Notwithstanding, it is questionable whether the MIC concerning limb deficiency is set at the correct level for determining eligibility for participating in Paralympic sports. This study aims to provide an overview of the evidence examining the impact of different partial foot amputation (PFA) levels on gait as a proxy for sporting performance. This scoping review will be based on a 6-step methodological framework and Preferred Reporting Items for Systematic Reviews and Meta-Analysis, extension for scoping reviews (PRISMA-ScR). Studies will be selected from PubMed, Embase, CINAHL, and SPORTDiscus. Two authors will screen the titles/abstracts independently. Selected studies will be scrutinised, and the same authors will extract data. Findings will be relevant to informing the evidence-based development of MIC for lower limb impairment after PFA and may be extrapolated to specific Paralympic sports, including wheelchair tennis. Results will be disseminated through scientific publications and conferences to audiences interested in Paralympic sports.",,10.1016/j.smhs.2021.11.001,Amputation;Gait;Sports;Foot,NA,
rayyan-934859267,Psychological first aid for workers in care and nursing homes: systematic review.,2022,NA,NA,BMC nursing,1472-6955,21,1,96,Schoultz M and McGrogan C and Beattie M and Macaden L and Carolan C and Polson R and Dickens G,http://www.epistemonikos.org/documents/2c1379303dd1cb851edb890609cf570ed01d31bc,English,,,"BACKGROUND: The Covid-19 pandemic has produced unprecedented challenges across all aspects of health and social care sectors globally. Nurses and healthcare workers in care homes have been particularly impacted due to rapid and dramatic changes to their job roles, workloads, and working environments, and residents' multimorbidity. Developed by the World Health Organisation, Psychological First Aid (PFA) is a brief training course delivering social, emotional, supportive, and pragmatic support that can reduce the initial distress after disaster and foster future adaptive functioning.     OBJECTIVES: This review aimed to synthesise findings from studies exploring the usefulness of PFA for the well-being of nursing and residential care home staff.     METHODS: A systematic search was conducted across 15 databases (Social Care Online, Kings Fund Library, Prospero, Dynamed, BMJ Best Practice, SIGN, NICE, Ovid, Proquest, Campbell Library, Clinical Trials, Web of Knowledge, Scopus, Ebsco CINAHL, and Cochrane Library), identifying peer-reviewed articles published in English language from database inception to 20th June 2021.     RESULTS: Of the 1,159 articles screened, 1,146 were excluded at title and abstract; the remaining 13 articles were screened at full text, all of which were then excluded.     CONCLUSION: This review highlights that empirical evidence of the impact of PFA on the well-being of nursing and residential care home staff is absent. PFA has likely been recommended to healthcare staff during the Covid-19 pandemic. The lack of evidence found here reinforces the urgent need to conduct studies which evaluates the outcomes of PFA particularly in the care home staff population.",,10.1186/s12912-022-00866-6,"Nursing Homes;Nurses, Community Health",NA,
