key,title,year,month,day,journal,issn,volume,issue,pages,authors,url,language,publisher,location,abstract,notes,doi,keywords,pubmed_id,pmc_id
rayyan-934859151,Alternating selection for dispersal and multicellularity favors regulated life cycles,2022,1,1,bioRxiv,,NA,NA,2022.10.14.512267,"Barrere, Julien and Nanda, Piyush and Murray, Andrew W.",http://biorxiv.org/content/early/2022/10/18/2022.10.14.512267.abstract,,,,"The evolution of complex multicellularity opened paths to increased morphological diversity and organizational novelty. This transition involved three processes: cells remained attached to one another to form groups, cells within these groups differentiated to perform different tasks, and the groups evolved new reproductive strategies15. Recent experiments identified selective pressures and mutations that can drive the emergence of simple multicellularity and cell differentiation611 but the evolution of life cycles, in particular, how simple multicellular forms reproduce has been understudied. The selective pressure and mechanisms that produced a regular alternation between single cells and multicellular collectives are still unclear12. To probe the factors regulating simple multicellular life cycles, we examined a collection of wild isolates of the budding yeast, S. cerevisiae12. We found that all these strains can exist as multicellular clusters, a phenotype that is controlled by the mating type locus and strongly influenced by the nutritional environment. Inspired by this variation, we engineered inducible dispersal in a multicellular laboratory strain and demonstrated that a regulated life cycle has an advantage over constitutively single-celled or constitutively multicellular life cycles when the environment alternates between favoring intercellular cooperation (a low sucrose concentration) and dispersal (a patchy environment generated by emulsion). Our results suggest that simple multicellularity in wild isolates could be under selection and is regulated by their genetic composition and the environments they encounter and that alternating patterns of resource availability may have played a role in the evolution of life cycles.Competing Interest StatementThe authors have declared no competing interest.",,10.1101/2022.10.14.512267,"Social Control, Informal;Social Control, Formal",NA,
rayyan-934859152,Arabidopsis Nicotianamine Synthases (NAS) comprise a common core-NAS domain fused to a variable auto-inhibitory C-terminus,2022,1,1,bioRxiv,,NA,NA,2022.10.13.512114,"Seebach, Hiroyuki and Radow, Gabriel and Brunek, Michael and Schulz, Frank and Piotrowski, Markus and Krmer, Ute",http://biorxiv.org/content/early/2022/10/17/2022.10.13.512114.abstract,,,,"Nicotianamine Synthase (NAS) catalyzes the biosynthesis of nicotianamine (NA) from the 2-aminobutyrate moieties of three S-adenosylmethionine molecules. NA has central roles in metal nutrition and metal homeostasis of flowering plants. Despite the availability of crystal structures of archaeal and bacterial NAS-like proteins that carry out simpler aminobutanoyltransferase reactions, the enzymatic function of NAS remains poorly understood. Here we report amino acids essential for the activity of AtNAS1 based on structural modeling and site-directed mutagenesis. An enzyme-coupled continuous activity assay allowed us to compare differing NAS proteins identified through multiple sequence alignments and phylogenetic analyses. In most class Ia and b NAS proteins of dicotyledonous and monocotyledonous angiosperm plants, respectively, the core-NAS domain is fused to a variable C-terminal domain. Compared to fungal and moss NAS (class III) that consist merely of the core-NAS domain, NA biosynthetic activities of the four paralogous Arabidopsis NAS proteins were far lower. Yet their C-terminally trimmed core-NAS variants exhibited strongly elevated activities. Out of 320 amino acids of AtNAS1, twelve, 287-TRGCMFMPCNCS-298, accounted for the auto-inhibitory effect of the C-terminus, with approximately one third contributed by N296 within a CNCS motif that is conserved in Arabidopsis. No detectable NA biosynthesis was mediated by two representatives of groups of plant NAS proteins that naturally lack the C-terminal domain, class Ia Arabidopsis halleri NAS5, and Medicago truncatula NAS2 of class II which is found in dicots and diverged early during the evolution of flowering plants. Our results suggest that NAS activity is under stringent post-translational control in plants.Competing Interest StatementThe authors have declared no competing interest.",,10.1101/2022.10.13.512114,Arabidopsis,NA,
rayyan-934859153,Iron Inhibits Glioblastoma Cell Migration and Polarization,2022,1,1,bioRxiv,,NA,NA,2022.10.13.512175,"Shenoy, Ganesh and Kheirabadi, Sina and Ataie, Zaman and Palsa, Kondaiah and Wade, Quinn and Khunsriraksakul, Chachrit and Khristov, Vladimir and Slagle-Webb, Becky and Lathia, Justin D. and Wang, Hong-Gang and Sheikhi, Amir and Connor, James R.",http://biorxiv.org/content/early/2022/10/14/2022.10.13.512175.abstract,,,,"Glioblastoma is one of the deadliest malignancies facing modern oncology today. The ability of glioblastoma cells to diffusely spread into neighboring healthy brain makes complete surgical resection nearly impossible and contributes to the recurrent disease faced by most patients. Although research into the impact of iron on glioblastoma has addressed proliferation, there has been little investigation into how cellular iron impacts the ability of glioblastoma cells to migrate - a key question especially in the context of the diffuse spread observed in these tumors. Herein, we show that increasing cellular iron content results in decreased migratory capacity of human glioblastoma cells. The decrease in migratory capacity was accompanied by a decrease in cellular polarization in the direction of movement. Expression of CDC42, a Rho GTPase that is essential for both cellular migration and establishment of polarity in the direction of cell movement, was reduced upon iron treatment. Bioinformatic analysis of CDC42 mRNA revealed a potential iron-responsive element that may contribute to the regulation of CDC42 by iron. We then analyzed a single-cell RNA-seq dataset of human glioblastoma samples and found that cells at the tumor periphery had a gene signature that is consistent with having lower levels of cellular iron. Altogether, our results suggest that cellular iron content is impacting glioblastoma cell migratory capacity and that cells with higher iron levels exhibit reduced motility.Competing Interest StatementJ.R.C is a founder and chairman of the board of Siderobioscience LLC, a company founded on patented technology for management of iron deficiency. The product from this company was not used in the studies reported in this manuscript. All other authors report no conflicts of interest.",,10.1101/2022.10.13.512175,Oxalic Acid;Iron;Glioblastoma,NA,
rayyan-934859154,"2,4-Di-tert-butylphenol Induces Adipogenesis in Human Mesenchymal Stem Cells by Activating Retinoid X Receptors",2022,1,1,bioRxiv,,NA,NA,2022.10.08.511439,"Ren, Xiao-Min and Chang, Richard C. and Huang, Yikai and Amato, Anglica Amorim and Carivenc, Coralie and Grimaldi, Marina and Kuo, Angela Y. and Balaguer, Patrick and Bourguet, William and Blumberg, Bruce",http://biorxiv.org/content/early/2022/10/09/2022.10.08.511439.abstract,,,,"2,4-di-tert-butylphenol (2,4-DTBP) is an important commercial antioxidant and a toxic natural secondary metabolite that has been detected in humans. However, there is scant information regarding its toxicological effects. Here we asked whether 2,4-DTBP is a potential obesogen. Using a human mesenchymal stem cell (MSC) adipogenesis assay, we found that exposure to 2,4-DTBP led to increased lipid accumulation and expression of adipogenic marker genes. Antagonist assays revealed that 2,4-DTBP increased lipid accumulation by activating the peroxisome proliferator-activated receptor  (PPAR)-retinoid X receptor (RXR) heterodimer. 2,4-DTBP likely activated the PPAR/RXR heterodimer by activating RXR but not directly binding to PPAR. We confirmed that 2,4-DTBP directly bound to RXR by solving the crystal structure of this complex, then predicted and demonstrated that related compounds could also activate RXR. Our study demonstrated that 2,4-DTBP and related chemicals could act as obesogens and endocrine disruptors via RXR. These data showed that 2,4-DTBP belongs to a family of compounds whose endocrine-disrupting and obesogenic effects can be strongly modulated by their chemical composition and that structure-activity studies such as the present one could help guide the rational development of safer antioxidants.SYNOPSIS Little research exists on the effects of commercially valuable antioxidants on biological systems. This study reports that di- and tri-tert-butylphenols can act as endocrine disruptors and potential obesogens by activating nuclear hormone receptors.Competing Interest StatementBruce Blumberg is a named inventor on patents related to PPARgamma and other nuclear hormone receptors.DTBPdi-tert-butyl phenolTTBPtri-tert-butyl-phenolDTBBdi-tert-butylbenzeneTTBBtri-tert-butylbenzeneROSIrosiglitazoneRXRretinoid X receptor, aka 9-cis retinoic acid receptorPPARperoxisome proliferator activated receptorRARretinoic acid receptorBMIbody mass indexSPAsynthetic phenolic antioxidantBHT2,6-di-tert-butyl-4-methylphenol, BHA-3-tert-butyl-4-hydroxyanisosleGMgeometric mean, BHTLXRliver X receptorTRthyroid hormone receptorEDCendocrine disrupting chemicalMSCmultipotent mesenchymal stromal stem cellFBSfetal bovine serumDMSODimethylsulfoxideQPCRquantitative real time reverse transcriptase polymerase chain reactionFABP4fatty acid binding protein 4FSP27fat-specific protein of 27 kDaPPAR2peroxisome proliferator activated receptor gamma 2LPLlipoprotein lipaseLBDligand-binding domainLBPligand-binding pocketDBDDNA-binding domainEDTAethylene diaminetetraacetic acidDTTdithiothreitol.",,10.1101/2022.10.08.511439,Humanities;Humanism;Humans,NA,
rayyan-934859155,Recycling limits the lifetime of actin turnover,2022,1,1,bioRxiv,,NA,NA,2022.09.30.510257,"Colin, Alexandra and Kotila, Tommi and Gurin, Christophe and Orhant-Prioux, Magali and Vianay, Benoit and Mogilner, Alex and Lappalainen, Pekka and Thry, Manuel and Blanchoin, Laurent",http://biorxiv.org/content/early/2022/10/04/2022.09.30.510257.abstract,,,,"Intracellular organization is largely mediated by the actin turnover. Cellular actin networks consume matter and energy to sustain their dynamics, while maintaining their appearance. This behavior, called dynamic steady state, enables cells to sense and adapt to their environment. However, how structural stability can be maintained during the constant turnover of a limited actin monomer pool is poorly understood. To answer this question, we developed an experimental system using actin bead motility in a compartment with a limited amount of monomer. We used the speed and the size of the actin comet tails to evaluate the systems monomer consumption and its lifetime. We established the relative contribution of actin assembly, disassembly and recycling for a bead movement over tens of hours. Recycling mediated by cyclase-associated proteins is the key step in allowing the reuse of monomers for multiple assembly cycles. Energy supply and protein aging are also factors that limit the lifetime of actin turnover. This work reveals the balancing mechanism for long-term network assembly with a limited amount of building blocks.Competing Interest StatementThe authors have declared no competing interest.",,10.1101/2022.09.30.510257,,NA,
rayyan-934859156,Topic modeling for multi-omic integration in the human gut microbiome and implications for Autism,2022,1,1,bioRxiv,,NA,NA,2022.09.30.509056,"Tataru, Christine and Peras, Marie and Rutherford, Erica and Dunlap, Kaiti and Yin, Xiaochen and Chrisman, Brianna S. and DeSantis, Todd Z. and Wall, Dennis P. and Iwai, Shoko and David, Maude M.",http://biorxiv.org/content/early/2022/10/03/2022.09.30.509056.abstract,,,,"While healthy gut microbiomes are critical to human health, pertinent microbial processes remain largely undefined, partially due to differential bias among profiling techniques. By simultaneously integrating multiple profiling methods, multi-omic analysis can define generalizable microbial pro-cesses, and is especially useful in understanding complex conditions such as Autism. Challenges with integrating heterogeneous data produced by multiple profiling methods can be overcome using Latent Dirichlet Allocation (LDA), a promising natural language processing technique that identifies topics in heterogeneous documents.In this study, we apply LDA to multi-omic microbial data (16S rRNA amplicon, shotgun metagenomic, shotgun metatranscriptomic, and untargeted metabolomic profiling) from the stool of 81 children with and without Autism. We identify topics, or microbial processes, that summarize complex phenomena occurring within gut microbial communities. We then subset stool samples by topic distribution, and identify metabolites, specifically neurotransmitter precursors and fatty acid derivatives, that differ significantly between children with and without Autism. We identify clusters of topics, deemed cross-omic topics, which we hypothesize are representative of generalizable microbial processes observable regardless of profiling method. Interpreting topics, we find each represents a particular diet, and we heuristically label each cross-omic topic as: healthy/general function, age-associated function, transcriptional regulation, and opportunistic pathogenesis.Competing Interest StatementThe authors declare a conflict of interest. The authors affiliated with Second Genome, Inc. have the following competing interests: Second Genome Inc. employs and provides stock options to all authors affiliated with Second Genome Inc. MMD has a financial interest in Second Genome Inc. Second Genome Inc. is an independent therapeutics company with products in development to treat Inflammatory Bowel Diseases and Cancer, and could potentially benefit from the outcomes of this research. MMD is co-owner of Microbiome Engineering Inc., a company specialized in developing biosensors. DPW is cofounder of Cognoa, a company focused on digital methods for healthy child development.",,10.1101/2022.09.30.509056,Humanities;Humanism;Humans;Autistic Disorder,NA,
rayyan-934859157,Microphysiological Drug-Testing Platform for Identifying Responses to Prodrug Treatment in Primary Leukemia,2022,1,1,bioRxiv,,NA,NA,2022.04.06.483760,"Gke, Furkan and Kaestli, Alicia and Lohasz, Christian and de Geus, Martina and Kaltenbach, Hans-Michael and Renggli, Kasper and Bornhauser, Beat and Hierlemann, Andreas and Modena, Mario",http://biorxiv.org/content/early/2022/12/20/2022.04.06.483760.abstract,,,,"Despite increasing survival rates of pediatric leukemia patients over the past decades, the outcome of some leukemia subtypes has remained dismal. Drug sensitivity and resistance testing on patient-derived leukemia samples provide important information to tailor treatments for high-risk patients. However, currently used well-based drug screening platforms have imitations in predicting the effects of prodrugs, a class of therapeutics that require metabolic activation to become effective. To address this issue, we developed a microphysiological drug-testing platform that enables co-culturing of patient-derived leukemia cells, human bone marrow mesenchymal stromal cells, and human liver microtissues within the same microfluidic platform. This platform also enables to control the physical interaction between the diverse cell types. We were able to recapitulate hepatic prodrug activation of ifosfamide in our platform, which is very difficult in traditional well-based assays. By testing the susceptibility of primary patient-derived leukemia samples to the prodrug ifosfamide, we identified sample-specific sensitivities to ifosfamide in primary leukemia samples. We found that our microfluidic platform enabled the recapitulation of physiologically relevant conditions and the testing of prodrugs including short-lived and unstable metabolites. The platform holds great potential for clinical translation and precision chemotherapy selection.Competing Interest StatementThe authors have declared no competing interest.",,10.1101/2022.04.06.483760,Leukemia;Prodrugs,NA,
rayyan-934859158,Biomass generation and heterologous isoprenoid milking from engineered microalgae grown in anaerobic membrane bioreactor effluent,2022,1,1,bioRxiv,,NA,NA,2022.09.29.510234,"de Freitas, Brbara Bastos and Overmans, Sebastian and Medina, Julie Sanchez and Hong, Pei-Ying and Lauersen, Kyle J.",http://biorxiv.org/content/early/2022/09/30/2022.09.29.510234.abstract,,,,"Wastewater (WW) treatment in anaerobic membrane bioreactors (AnMBR) is considered more sustainable than in their aerobic counterparts. However, outputs from AnMBR are mixed methane and carbon dioxide gas streams as well as ammonium- (N) and phosphate- (P) containing waters. Using AnMBR outputs as inputs for photoautotrophic algal cultivation can strip the CO2 and remove N and P from effluent which feed algal biomass generation. Recent advances in algal engineering have generated strains for concomitant high-value side product generation in addition to biomass, although only shown in heavily domesticated, lab-adapted strains. Here, investigated whether such a strain of Chlamydomonas reinhardtii could be grown directly in AnMBR effluent with CO2 at concentrations found in its off-gas. The domesticated strain was found to proliferate over bacteria in the non-sterile effluent, consume N and P to levels that meet general discharge or reuse limits, and tolerate cultivation in modelled (extreme) outdoor environmental conditions prevalent along the central Red Sea coast. High-value co-product milking was then demonstrated, up to 837 g L1 culture in 96 h, in addition to algal biomass production, 2.4 g CDW L1 in 96 h, directly in effluents. This is the first demonstration of a combined bio-process that employs a heavily engineered algal strain to enhance the product generation potentials from AnMBR effluent treatment. This study shows it is possible to convert waste into value through use of engineered algae while also improve wastewater treatment economics through co-product generation.Competing Interest StatementThe authors have declared no competing interest.",,10.1101/2022.09.29.510234,Norisoprenoids,NA,
rayyan-934859159,Discovery of homogentisic acid as a precursor in trimethoprim metabolism and natural product biosynthesis,2022,1,1,bioRxiv,,NA,NA,2022.09.22.509022,"McAvoy, Andrew C. and Threatt, Paxton H. and Kapcia, Joseph and Garg, Neha",http://biorxiv.org/content/early/2022/09/25/2022.09.22.509022.abstract,,,,"Opportunistic infections by Burkholderia cenocepacia are life threatening for patients suffering from cystic fibrosis and chronic granulomatous disease. These infections are often associated with variable clinical outcomes, prompting an interest into molecular investigations of phenotypes associated with disease severity. The production of the pyomelanin pigment is one such phenotype, which was recently linked to the ability of clinical strains to carry out biotransformation of the antibiotic trimethoprim. However, this biotransformation product was not identified, and differences in metabolite production associated with pyomelanin pigmentation are poorly understood. Here, we identify several key metabolites produced exclusively by the pyomelanin-producing strains. To provide insight into the structures and biosynthetic origin of these metabolites, we developed a mass spectrometry-based strategy coupling unsupervised in silico substructure prediction with stable isotope labeling referred to as MAS-SILAC (Metabolite Annotation assisted by Substructure discovery and Stable Isotope Labeling by Amino acids in Cell culture). This approach led to discovery of homogentisic acid as a precursor for biosynthesis of several natural products and for biotransformation of trimethoprim, representing a previously unknown mechanism of antibiotic tolerance. This work presents application of computational methods for analysis of untargeted metabolomic data to link the chemotype of pathogenic microorganisms with a specific phenotype. The observations made in this study provide insights into the clinical significance of the melanated phenotype.Competing Interest StatementThe authors have declared no competing interest.AbbreviationsUHPLC-HRMS/MSultra-high performance liquid chromatography high-resolution tandem mass spectrometry3MT-HAtrimethylthiolated homogentisic acid.",,10.1101/2022.09.22.509022,Trimethoprim,NA,
rayyan-934859160,Ultrahigh-throughput Absorbance Activated Droplet Sorting (UHT-AADS) for enzyme screening at kilohertz frequencies,2022,1,1,bioRxiv,,NA,NA,2022.09.13.507731,"Medcalf, Elliot J. and Gantz, Maximilian and Kaminski, Tomasz S. and Hollfelder, Florian",http://biorxiv.org/content/early/2022/09/13/2022.09.13.507731.abstract,,,,"Droplet microfluidics is a valuable method to beat the odds in high throughput screening campaigns such as directed evolution, where valuable hits are infrequent and large library sizes are required. Absorbance-based sorting expands the landscape of range of enzyme families that can be subjected to droplet screening by expanding possible assays beyond fluorescence detection. However, absorbance activated droplet sorting (AADS) is currently 10-fold slower than typical fluorescence activated droplet sorting (FADS), meaning that, in comparison, a larger portion of sequence space is inaccessible due to throughput constraints. Here we improve AADS to reach kHz sorting speeds in an order of magnitude increase over previous designs, with close-to-ideal sorting accuracy. This is achieved by a combination of (i) the use of refractive index matching oil that improves signal quality by removal of side scattering (increasing the sensitivity of absorbance measurements); (ii) a sorting algorithm capable of reaching 4 kHz with an Arduino Due; and (iii) a chip design that transmits product detection better into sorting decisions without false positives, namely a single-layered inlet to space droplets further apart and injections of bias oil providing a fluidic barrier preventing droplets from entering the incorrect sorting channel. The updated ultrahigh-throughput absorbance activated droplet sorter (UHT-AADS) increases the effective sensitivity of absorbance measurements through better signal quality at a speed that matches the more established fluorescence-activated sorting devices.Competing Interest StatementThe authors have declared no competing interest.",,10.1101/2022.09.13.507731,,NA,
rayyan-934859161,Predicting microbial community compositions in wastewater treatment plants using artificial neural networks,2022,1,1,bioRxiv,,NA,NA,2022.09.08.507071,"Liu, Xiaonan and Nie, Yong and Wu, Xiao-Lei",http://biorxiv.org/content/early/2022/09/11/2022.09.08.507071.abstract,,,,"Activated sludge (AS) of wastewater treatment plants (WWTP) is one of the worlds largest artificial microbial ecosystems and the microbial community of the AS system is closely related to WWTP performance. However, how to predict its community structure is still unclear. Here, we used artificial neural networks (ANN) to predict the microbial compositions of AS systems collected from WWTPs located worldwide. We demonstrated that the microbial compositions of AS systems are predictable using our approach. The predictive accuracy R21:1 of Shannon-Wiener index reached 60.42%, and the average R21:1 of ASVs appearing in at least 10% of samples (ASVs&amp;gt;10%) and core taxa were 35.09% and 42.99%, respectively. We also found that the predictability of ASVs&amp;gt;10% was significantly positively correlated with their relative abundance and occurrence frequency, but significantly negatively correlated with potential migration rate. The typical functional groups such as nitrifiers, denitrifiers, polyphosphate-accumulating organisms (PAOs) and glycogen-accumulating organisms (GAOs), and filamentous organisms in AS systems could also be well recovered using an ANN model, with the R21:1 ranging from 32.62% to 56.81%. Furthermore, we found that industry wastewater source (IndConInf) had good predictive abilities, although its correlation with ASVs&amp;gt;10% in the Mantel test analysis was weak, which suggested important factors that cannot be identified using traditional methods may be highlight by the ANN model. Our results provide a better understanding of the factors affecting AS communities through the prediction of the microbial community of AS systems, which could lead to insights for improved operating parameters and control of community structure.Competing Interest StatementThe authors have declared no competing interest.",,10.1101/2022.09.08.507071,Neural Networks (Computer);Nerve Net,NA,
